{
  "MAVEN_OPTS": {
    "Xmx": "512m",
    "XX:MaxPermSize": "256m"
  },
  "JAVA_OPTS": {
    "xmx": "2g",
    "maxPermSize": "256m"
  },
  "IterationCount": 10,
  "MinSize": 1,
  "MaxSize": 8,
  "ModificationMethod": "constant",
  "ModificationConstant": 10,
  "Queries": [ 
	"PosLength",
    "ConnectedSegments"
  ],
  "Scenarios": [
    "User",
    "Repair"
  ],
  "Series": 1,
  "Tools": [
    "virtuoso"
  ],
  "UniqueConfigurations": [
	]
}
